{
  "$schema": "../schemas/scene.schema.json",
  "id": "beach",
  "title": "Beach Day",
  "description": "Follow Beth to the beach for a giant ocean reveal.",
  "startingLocation": "town",
  "destinationLocation": "beach",
  "revealSoundPath": "",
  "transitionSoundPath": "",
  "participatingCharacters": [
    {
      "id": "beth",
      "character": "beth",
      "spawnPoint": "townCenter"
    }
  ],
  "dialogueSequence": [
    {
      "speaker": "beth",
      "text": "Let's go to the beach."
    }
  ],
  "scriptedMovements": [
    {
      "actor": "beth",
      "trigger": "afterDialogue",
      "path": [
        { "x": 8, "y": 7 },
        { "x": 7, "y": 8 },
        { "x": 5, "y": 8 },
        { "x": 3, "y": 8 }
      ]
    }
  ],
  "punchlineReveal": {
    "text": "Yep. That is a huge ocean.",
    "color": "#e0f2fe"
  },
  "titleCard": {
    "showOnStart": true,
    "title": "Beach Day",
    "subtitle": "A quick walk to the world's largest scenic reveal",
    "duration": 2400,
    "background": "#0f172a",
    "alpha": 0.9,
    "color": "#f8fafc",
    "subtitleColor": "#bae6fd"
  }
}
