{
  "$schema": "../schemas/scene.schema.json",
  "id": "gym",
  "title": "Gym Friend",
  "description": "A quick session turns into a suspiciously oversized gym.",
  "startingLocation": "town",
  "destinationLocation": "gym",
  "revealSoundPath": "",
  "transitionSoundPath": "",
  "participatingCharacters": [
    {
      "id": "mate",
      "character": "gym-friend",
      "spawnPoint": "townCenter"
    }
  ],
  "dialogueSequence": [
    {
      "speaker": "mate",
      "text": "Quick session?"
    }
  ],
  "scriptedMovements": [
    {
      "actor": "mate",
      "trigger": "afterDialogue",
      "path": [
        { "x": 10, "y": 6 },
        { "x": 12, "y": 6 },
        { "x": 17, "y": 8 },
        { "x": 20, "y": 10 }
      ]
    }
  ],
  "punchlineReveal": {
    "text": "Quick session, apparently.",
    "color": "#fef2f2"
  },
  "titleCard": {
    "showOnStart": true,
    "title": "Gym Friend",
    "subtitle": "One quick session and absolutely no escalation",
    "duration": 2400,
    "background": "#111827",
    "alpha": 0.9,
    "color": "#f8fafc",
    "subtitleColor": "#fecaca"
  }
}
